{"authority_envelope":{"identity":"crazycraft-t1-remote","payload_sha256":"59ae1692bcc3896ee720da625c52104d744a63dde1acf816a2d79e5691ce4ed4","scheme":"SHA256_CANONICAL_JSON_LOCAL_ENVELOPE","verification":"TAMPER_EVIDENT_ONLY"},"candidate_inputs_accessed":["behavior.mcpack","resource.mcpack","candidate.mcaddon","request.json"],"cleanup_status":"SCRATCH_REMOVED","codex_session_identifier":null,"disclosure_policy_scan":{"matches":[],"status":"PASS"},"docker_container_ids":[],"ended_at":"2026-07-29T15:23:21Z","entrypoint":["remote_job_entrypoint.py","activate","T1","JOB-000000000011"],"evidence_roots_accessed":[],"exit_status":1,"input_manifest_sha256":"71605630eae10c1a3579a0997ab463af7f7607ee8952d4d1e11575c02fcfa7b5","job_id":"JOB-000000000011","job_type":"BDS_QUALIFICATION","outputs":[{"relative_path":"result.json","sha256":"7d021e106201305551c5b8e233b160e8b8878b99e831da7190ad009c048815e7","size_bytes":786},{"relative_path":"report.md","sha256":"803eb5bffbba75c5d3d21fac09d8c1cbd8cf4d316faca9f18355dacc1418d122","size_bytes":68}],"proof_boundary":"Job-local execution and disclosure scan only; host/account separation requires independent authority.","receipt_payload_sha256":"9955c1b786d024289b324da245f78b8bdc246d1563f82129e533736982cb3aea","request_sha256":"23547719916a6c1040d57d4b46fe9c969fa321aefee319a859886437163b6d4f","requesting_authority":"T1","schema_version":"crazycraft-remote-v1","started_at":"2026-07-29T15:23:20Z","studio_executor_identity":"crazycraft-t1-remote","studio_host_identity":"BlakeStacStudio.hsd1.pa.comcast.net"}
